{
  "schema_version": 1,
  "reviewed_at": "2026-08-11",
  "phase_status": "BLOCKED",
  "blockers": [
    "No TickerAll development API key is available in the workspace environment.",
    "No MetaApi development token is available in the workspace environment.",
    "No disposable prop-firm and two retail MT5 demo account cases are available.",
    "TickerAll's public contract does not document required pending-order management, instrument specifications, or stream replay ordering.",
    "Broker and prop-firm third-party cloud access permission has not been retained in writing."
  ],
  "provider_decisions": [
    {
      "provider": "tickerall",
      "decision": "CONDITIONAL_STOP",
      "evidence_level": "DOC",
      "reasons": [
        "Pending-order list, modify, cancel, and stream lifecycle are not documented.",
        "Complete broker instrument specifications are not documented.",
        "Stream sequence/resume and production legal/security evidence are incomplete."
      ]
    },
    {
      "provider": "metaapi",
      "decision": "PROCEED",
      "evidence_level": "DOC",
      "reasons": [
        "The documented API surface covers the required account, pending-order, trade, history, specification, and synchronization capabilities.",
        "Trade idempotency and ambiguous-outcome recovery still require live proof."
      ]
    }
  ],
  "cases": []
}
